{
  "$schema": "https://json-schema.org/draft/2020-12/schema",
  "$id": "https://gethatch.pet/schemas/lookdev-light3d-v1",
  "title": "Hatch look development light3d v1",
  "description": "Contract validity alone proves no executed shader or renderer capability.",
  "$defs": {
    "light3d": {
      "type": "object",
      "additionalProperties": false,
      "properties": {
        "schema_version": {
          "const": 1
        },
        "id": {
          "type": "string",
          "pattern": "^[A-Za-z0-9][A-Za-z0-9._:-]{0,127}$(?![\\s\\S])"
        },
        "version": {
          "type": "string",
          "pattern": "^(0|[1-9][0-9]*)\\.(0|[1-9][0-9]*)\\.(0|[1-9][0-9]*)$(?![\\s\\S])"
        },
        "name": {
          "type": "string",
          "minLength": 1,
          "maxLength": 4096
        },
        "description": {
          "type": "string",
          "minLength": 1,
          "maxLength": 4096
        },
        "dependencies": {
          "type": "array",
          "items": {
            "$ref": "#/$defs/ResourceRef"
          },
          "minItems": 0,
          "maxItems": 256
        },
        "provenance": {
          "type": "object",
          "additionalProperties": false,
          "properties": {
            "origin": {
              "enum": [
                "import",
                "authored",
                "derived",
                "procedural-fixture"
              ]
            },
            "tool": {
              "type": "string",
              "minLength": 1,
              "maxLength": 4096
            },
            "created_at": {
              "type": "string",
              "pattern": "^\\d{4}-\\d\\d-\\d\\dT\\d\\d:\\d\\d:\\d\\dZ$"
            },
            "source_hashes": {
              "type": "array",
              "items": {
                "type": "string",
                "pattern": "^[0-9a-f]{64}$(?![\\s\\S])"
              },
              "minItems": 0,
              "maxItems": 1024
            },
            "attribution": {
              "type": "string",
              "minLength": 1,
              "maxLength": 4096
            },
            "license": {
              "type": "object",
              "additionalProperties": false,
              "properties": {
                "identifier": {
                  "type": "string",
                  "minLength": 1,
                  "maxLength": 4096
                },
                "source": {
                  "type": "string",
                  "minLength": 1,
                  "maxLength": 4096
                }
              },
              "required": [
                "identifier",
                "source"
              ]
            }
          },
          "required": [
            "origin",
            "tool",
            "created_at",
            "source_hashes",
            "attribution",
            "license"
          ]
        },
        "validation_status": {
          "enum": [
            "unvalidated",
            "structurally-valid",
            "rejected"
          ]
        },
        "tags": {
          "type": "array",
          "items": {
            "type": "string",
            "pattern": "^[A-Za-z0-9][A-Za-z0-9._:-]{0,127}$(?![\\s\\S])"
          },
          "minItems": 0,
          "maxItems": 64
        },
        "capabilities": {
          "type": "array",
          "items": {
            "type": "string",
            "pattern": "^[A-Za-z0-9][A-Za-z0-9._:-]{0,127}$(?![\\s\\S])"
          },
          "minItems": 0,
          "maxItems": 64
        },
        "kind": {
          "const": "light3d"
        },
        "type": {
          "enum": [
            "point",
            "directional",
            "spot",
            "area",
            "environment"
          ]
        },
        "transform": {
          "type": "object",
          "additionalProperties": false,
          "properties": {
            "translation_meters": {
              "type": "array",
              "items": {
                "type": "number",
                "minimum": -1000000000.0,
                "maximum": 1000000000.0
              },
              "minItems": 3,
              "maxItems": 3
            },
            "rotation_xyzw": {
              "type": "array",
              "items": {
                "type": "number",
                "minimum": -1000000000.0,
                "maximum": 1000000000.0
              },
              "minItems": 4,
              "maxItems": 4
            }
          },
          "required": [
            "translation_meters",
            "rotation_xyzw"
          ]
        },
        "color": {
          "type": "object",
          "additionalProperties": false,
          "properties": {
            "value": {
              "type": "array",
              "items": {
                "type": "number",
                "minimum": 0,
                "maximum": 1
              },
              "minItems": 3,
              "maxItems": 3
            },
            "encoding": {
              "enum": [
                "linear-srgb",
                "srgb"
              ]
            }
          },
          "required": [
            "value",
            "encoding"
          ]
        },
        "intensity": {
          "type": "object",
          "additionalProperties": false,
          "properties": {
            "value": {
              "type": "number",
              "minimum": 0,
              "maximum": 1000000000.0
            },
            "unit": {
              "enum": [
                "candela",
                "lux",
                "watt",
                "watt-per-square-meter"
              ]
            }
          },
          "required": [
            "value",
            "unit"
          ]
        },
        "temperature_kelvin": {
          "type": "number",
          "minimum": 1000,
          "maximum": 40000
        },
        "radius_meters": {
          "type": "number",
          "minimum": 0,
          "maximum": 1000000000.0
        },
        "spot_inner_radians": {
          "type": "number",
          "minimum": 0,
          "maximum": 3.141592653589793
        },
        "spot_outer_radians": {
          "type": "number",
          "exclusiveMinimum": 0,
          "maximum": 3.141592653589793
        },
        "area_size_meters": {
          "type": "array",
          "items": {
            "type": "number",
            "exclusiveMinimum": 0,
            "maximum": 1000000000.0
          },
          "minItems": 2,
          "maxItems": 2
        },
        "environment": {
          "$ref": "#/$defs/ResourceRef"
        },
        "casts_shadow": {
          "type": "boolean"
        },
        "render_policy": {
          "type": "object",
          "additionalProperties": false,
          "properties": {
            "strict": {
              "type": "boolean"
            },
            "allow_approximations": {
              "type": "boolean"
            },
            "required_features": {
              "type": "array",
              "items": {
                "type": "string",
                "pattern": "^[A-Za-z0-9][A-Za-z0-9._:-]{0,127}$(?![\\s\\S])"
              },
              "minItems": 0,
              "maxItems": 64,
              "uniqueItems": true
            },
            "fallback": {
              "enum": [
                "reject",
                "explicit-approximation",
                "bake"
              ]
            }
          },
          "required": [
            "strict",
            "allow_approximations",
            "required_features",
            "fallback"
          ]
        }
      },
      "required": [
        "schema_version",
        "id",
        "version",
        "dependencies",
        "provenance",
        "validation_status",
        "capabilities",
        "kind",
        "type",
        "transform",
        "color",
        "intensity",
        "casts_shadow",
        "render_policy"
      ]
    },
    "ResourceRef": {
      "type": "object",
      "additionalProperties": false,
      "properties": {
        "id": {
          "type": "string",
          "pattern": "^[A-Za-z0-9][A-Za-z0-9._:-]{0,127}$(?![\\s\\S])"
        },
        "version": {
          "type": "string",
          "pattern": "^(0|[1-9][0-9]*)\\.(0|[1-9][0-9]*)\\.(0|[1-9][0-9]*)$(?![\\s\\S])"
        },
        "path": {
          "type": "string",
          "minLength": 1,
          "maxLength": 4096
        },
        "sha256": {
          "type": "string",
          "pattern": "^[0-9a-f]{64}$(?![\\s\\S])"
        },
        "kind": {
          "enum": [
            "material3d",
            "material-instance3d",
            "material-variant3d",
            "texture3d",
            "material-graph3d",
            "light3d",
            "lighting-rig3d",
            "look3d",
            "render-quality3d"
          ]
        }
      },
      "required": [
        "id",
        "version",
        "path",
        "sha256",
        "kind"
      ]
    }
  },
  "$ref": "#/$defs/light3d"
}
