{"capabilities":[],"casts_shadow":true,"color":{"encoding":"linear-srgb","value":[1,0.9,0.8]},"dependencies":[],"id":"key","intensity":{"unit":"candela","value":100},"kind":"light3d","provenance":{"attribution":"Self-authored engineering fixture","created_at":"2026-10-23T00:00:00Z","license":{"identifier":"CC0-1.0","source":"self-authored"},"origin":"procedural-fixture","source_hashes":[],"tool":"lookdev-contract-tests"},"radius_meters":0.1,"render_policy":{"allow_approximations":false,"fallback":"reject","required_features":["metallic-roughness"],"strict":true},"schema_version":1,"transform":{"rotation_xyzw":[0,0,0,1],"translation_meters":[0,2,1]},"type":"point","validation_status":"unvalidated","version":"1.0.0"}
